Title,Date,Author,Speech,Category
Commencement Speech Transcript 2014 at Maharishi University of Management,30-05-2014,Jim Carrey,"Thank you. What are you sitting down for? I was going to milk that for a while. You guys can stretch that out in post, right? Can make that longer in the edit. Thank you, Bevin. Thank you all.

I brought one of my paintings to show you today. I hope you guys are going to be able to see it okay. Its not one of my bigger pieces. So you might want to move down front. Get a good look at it. Faculty, parents, friends, dignified guests, graduating class of 2014, and all the dead baseball players coming out of the corn to be with us today. After the harvest, theres no place for them to hide. Fields are empty. Theres no cover there. Im here to plant a seed today. A seed that will inspire you to move forward in life with enthusiastic hearts and a clear sense of wholeness. The question is will that seed have a chance to take root or will I be sued by Monsanto and forced to use their seed, which may not be totally Ayurvedic?

Excuse me if I seem a little bit low energy tonight, today, whatever this is, I slept with my head to the north last night. Oh man. Oh man. You know how that is, right kids? Yeah. Woke up right in the middle of Pitta, couldnt get back to sleep until Vata rolled around. Crazy. But I didnt freak out. I used that time to eat a large meal, connect with someone special on Tinder. Because life doesnt happen to you. It happens for you. How do I know this? I dont, but Im making sound and thats the important thing. Thats what Im here to do.

Sometimes I think thats the only thing thats important really, is just letting each other know were here. Reminding each other that were part of a larger self. I used to think Jim Carrey is all that I was. Just a flickering light, a dancing shadow. The great nothing masquerading as something you can name, seeking shelter in caves and foxholes dug out hastily. An archer searching for his target in the mirror, wounded only by my own arrows. Begging to be enslaved, leading for my chains. Blinded by longing and tripping over paradise.

Can I get an amen? You didnt think I could be serious, did you? I dont think you understand who youre dealing with. I have no limits. I cannot be contained because Im the container. You cant contain the container, man. You cant contain the container. I used to believe that who I was ended at the edge of my skin, that I had been given this little vehicle called a body from which to experience creation. And though I couldnt have asked for a sportier model, it was after all a loner and would have to be returned. Then I learned that everything outside the vehicle was part of me too, and now I drive a convertible. Top down, wind in my hair.

I am elated and truly, truly, truly excited to be present and fully connected to you at this important moment in your journey. I hope youre ready to open the roof and take it all in. Okay. Four more years then. Theyre obviously not ready. Just needs some more

I want to thank the trustees, the administrators, the faculty of MUM for creating an institution worthy of Maharishis ideals of education. A place that teaches knowledge and experience, the knowledge and experience necessary to be productive in life, as well as enabling the students through transcendental meditation and ancient Vedic knowledge to slack off twice a day for an hour and a half. Dont think youre fooling me. But I guess it has some benefits. It does allow you to separate who you truly are. And whats real from the stories that run through your head. You have given them the ability to walk behind the minds elaborate set decoration and to see that theres a huge difference between a dog that is going to eat you in your mind and an actual dog that is going to eat you.

That may sound like no big deal, but many never learned that distinction. And they spend a great deal of their lives living in fight or flight response. Id like to acknowledge all of you wonderful parents. Way to go. What a fantastic job youve done. For your tireless dedication, your love, your support, most of all for the attention that you paid to your children. I have a saying, be aware the unloved because they will eventually hurt themselves or me. But when I look at this group here, I feel really safe. I do. Im just going to say it. My room is not locked. My room is not locked. No doubt some of you will turn out to be crooks, but white collar stuff. You know, Wall Street, that type of thing. Crimes committed by people with self-esteem. Stuff parents can still be proud of in a weird way.

And to the graduating class of 2017 Minus three. You didnt let me finish. Congratulations. Yes. Give yourself a round of applause please. You are the vanguard of knowledge and consciousness, a new wave in a vast ocean of possibilities. On the other side of that door, theres a world starving for new ideas, new leadership. Ive been out there for 30 years. Shes a wild cat. Shell rub up against your leg and purr until you pick her up and start petting her. And then out of nowhere, shell swat you in the face. It can be rough out there, but thats okay because theres soft serve ice cream with sprinkles.

I guess thats what Im really trying to say here today. Sometimes its okay to eat your feelings. Now fear is going to be a player in your life, but you get to decide how much. You can spend your whole life imagining ghosts, worrying about the pathway to the future, but all there will ever be is whats happening here, and the decisions we make in this moment, which are based in either love or fear. So many of us choose our path out of fear disguised as practicality. What we really want seems impossibly out of reach and ridiculous to expect. So we never dare to ask the universe for it. Im saying Im the proof that you can ask the universe for it. Please. And if it doesnt happen for you right away, its only because the universe is so busy fulfilling my order. Party size.

My father could have been a great comedian, but he didnt believe that that was possible for him. And so he made a conservative choice. Instead, he got a safe job as an accountant. And when I was 12 years old, he was let go from that safe job and our family had to do whatever we could to survive. I learned many great lessons from my father, not the least of which was that you can fail at what you dont want so you might as well take a chance on doing what you love.

Its not the only thing he taught me though. I watched the effect of my fathers love and humor and how it altered the world around me, and I thought, Thats something to do. Thats something worth my time. It wasnt long before I started acting up. People would come over to the house and theyd be greeted by a seven year old, throwing himself down a large flight of stairs. They would say, What happened? And I would say, I dont know, lets check the replay. Id go back to the top of the stairs and come back down in slow motion. It was a very strange household.

My father used to brag that I wasnt a ham, I was the whole pig. And he treated my talent as if it was his second chance. When I was about 28, after a decade as a professional comedian, I realized one night in LA that the purpose of my life had always been to free people from concern, just like my dad. And when I realized this, I dubbed my new devotion the Church of Freedom From Concern, the Church of FFC. And I dedicated myself to that ministry. Whats yours? How will you serve the world? What did they need that your talent can provide? Thats all you have to figure out.

As someone whos done what youre about to go and do, I can tell you from experience the effect you have on others is the most valuable currency there is. Because everything you gain in life will rot and fall apart, and all that will be left of you is what was in your heart. My choosing to free people, my choosing to free people from concern got me to the top of a mountain. Look where I am, look what I get to do? Everywhere I go Im going to get emotional because when I tap into this, it really is extraordinary to me. I did something that made people present their best selves to me, wherever I go.

I am the top of the mountain, and I was. And the only one I hadnt freed was myself, and thats when my search for identity deepened. I wondered who Id be without my fame. Who would I be if I said things that people didnt want to hear, or if I defied their expectations of me? What if I showed up to the party without my Mardi Gras mask and refused to flash my breasts for a handful of beans? Ill give you a moment to wipe that image out of your mind. You guys are so ahead of the game. You already know who you are.

And that peace, that peace that were after lies somewhere beyond personality, beyond the perception of others, beyond invention and disguise. Even beyond effort itself. You can join the game, fight the wars, play with form all you want, but to find real peace you have to let the armor go. Your need for acceptance can make you invisible in this world. Dont let anything stand in the way of the light that shines through this form. Risk being seen in all of your glory.

Its not big enough. This painting is big for a reason. Its called High Visibility. Its about picking up the light and daring to be seen. Heres the tricky part. Everyone is attracted to the light. The party host up at the top, who thinks unconsciousness is bliss and is always offering to drink from the bottles that empty you. Misery, below her, despises the light, cant stand when youre doing well, wishes you nothing but the worst. The Queen of Diamonds, under him, needs a King to build her house of cards. And the hollow one down bottom there will clean to your leg and say, Please dont leave me behind for I have abandoned myself.

Even those who are closest to you and most in love with you, the people you love most in the world will find clarity confronting at times. This painting took me thousands of hours to complete. And when I was finished Thank you, thousands of hours, yes. Ill never get them back. Ill never get them back. I worked on this for so long. I was weeks and weeks like a madman alone on a scaffolding. And when I was finished, one of my friends said this would be a cool black light painting. So I started over.

Welcome to Burning Man. Some pretty crazy characters up there, but better up there than in here. Painting is one of the ways Thank you. Painting is one of the ways I free myself from concern. A way to stop the world through total mental, spiritual, and physical involvement. But even with that comes a feeling of divine dissatisfaction, because ultimately were not the avatars we create. Were not the pictures on the film stock. We are the light that shines through. All else is just smoke and mirrors, distracting but not truly compelling. Ive often said that I wish people could realize all their dreams and wealth and fame so that they could see that its not where youre going to find your sense of completion.

Like many of you, I was concerned about going out into the world and doing something bigger than myself, until someone smarter than myself made me realize that there is nothing bigger than myself. My soul is not contained within the limits of my body. My body is contained within the limitlessness of my soul. One unified field. One unified field of nothing dancing for no particular reason, except maybe to comfort and entertain itself.

As that shift happens in you, you wont be feeling the world, youll be felt by it. Youll be embraced by it. Now Im always at the beginning, I have a reset button and I ride that button constantly. Once that button is functioning in your life, theres no story that the mind could create that will be as compelling. The imagination is always manufacturing scenarios, both good and bad. And the ego tries to keep you trapped in the multiplex of the mind. Our eyes are not viewers. Theyre also projectors that are running a second story over the picture that we see in front of us all the time. Fear is writing that script, and the working title is Ill Never be Enough.

And youre going to look at a person like me and say, How could we ever hope to reach those kinds of heights, Jim? How can we make a painting thats too big for our home? How do you fly so high without a special breathing apparatus? This is the voice of the ego. And if you listen to it, there will always be someone whos doing better than you. No matter what you gain, ego will not let you rest. He will tell you that you cannot stop until youve left an indelible mark on the earth, until youve achieved immortality. How tricky is this ego that it would tempt us with a promise of something we already possess? So I just want you to relax. Thats my job. Relax and dream up a good life.

I had a substitute teacher from Ireland in the second grade that told my class during morning prayer that when she wants something, anything at all, she prays for it and promises something in return. And she always gets what she wants. Im sitting at the back of the classroom thinking, Wow, my family cant afford a bike. So I went home and I prayed for one and I promised I would recite the rosary every night in exchange. Broke it. Broke that promise. But two weeks later, I got home from school to find a brand new Mustang bike with a banana seat and easy rider handlebars. Yeah. From fool to cool.

My family informed me that I had won the bike in a raffle that a friend of mine had entered my name in without my knowledge whatsoever. So that type of thing has been happening to me ever since. As far as I can tell, its just about letting the universe know what you want and working toward it while letting go of how it comes to pass.

Your job is not to figure out how its going to happen for you, but to open the door in your head. And when the door opens in real life, just walk through it. And dont worry if you miss your cue because theres always doors opening. They keep opening. And when I say, Life doesnt happen to you, it happens for you. I really dont know if thats true. Im just making a conscious choice to perceive challenges as something beneficial so that I can deal with them in the most productive way. Youll come up with your own style. Thats part of the fun.

Oh, and why not take a chance on faith as well? Take a chance on faith, not religion, but faith. Not hope, but faith. I dont believe in hope. Hope is a beggar. Hope walks through the fire and faith leaps over it. You are ready and able to do beautiful things in this world. And after you walk through those doors today, you will only ever have two choices, love or fear. Choose love, and dont ever let fear turn you against your playful heart.

Thank you so much.. Im so honored. Thank you.",Persuasive
Ellen DeGeneres Commencement Address at Tulane University,22-05-2016,Ellen DeGeneres,"Oh boy, thank you so much, thank you so much. Thank you, President Cowan, Mrs. President Cowen; distinguished guests, undistinguished guests, you know who you are, honored faculty and creepy Spanish teacher. And thank you to all the graduating Class of 2009, I realize most of you are hungover and have splitting headaches and havent slept since Fat Tuesday, but you cant graduate til I finish, so listen up.

When I was asked to make the commencement speech, I immediately said yes. Then I went to look up what commencement meant which would have been easy if I had a dictionary, but most of the books in our house are Portias, and theyre all written in Australian. So I had to break the word down myself, to find out the meaning.

Commencement: common, and cement, common cement. You commonly see cement on sidewalks. Sidewalks have cracks, and if you step on a crack, you break your mothers back. So theres that. But Im honored that youve asked me here to speak at your common cement.

I thought that you had to be a famous alumnus, alumini, aluminum, alumis; you had to graduate from this school. And I didnt go to college here, and I dont know if President Cowan knows, I didnt go to any college at all, any college. And Im not saying you wasted your time, or money, but look at me, Im a huge celebrity.

Although I did graduate from the school of hard knocks, our mascot was the knockers. I spent a lot of time here growing up. My mom worked at Newcomb and I would go there every time I needed to steal something out of her purse.

But why am I here today? Clearly not to steal, youre too far away and Id never get away with it. Im here because of you. Because I cant think of a more tenacious, more courageous graduating class. I mean, look at you all, wearing your robes. Usually when youre wearing a robe at 10 in the morning, it means youve given up.

Im here because I love New Orleans. I was born and raised here, I spent my formative years here, and like you, while I was living here I only did laundry six times. When I finished school, I was completely lost and by school, I mean middle school, but I went ahead and finished high school anyway. And I really, I had no ambition; I didnt know what I wanted to do. I did everything from: I shucked oysters, I was a hostess, I was a bartender, I was a waitress, I painted houses, I sold vacuum cleaners; I had no idea and I thought Id just finally settle in some job and I would make enough money to pay my rent, maybe have basic cable, maybe not, I didnt really have a plan.

My point is that, by the time I was your age, I really thought I knew who I was but I had no idea. Like for example, when I was your age, I was dating men. So what Im saying is, when youre older, most of you will be gay. Is anybody writing this stuff down? Parents?

Anyway, I had no idea what I wanted to do with my life and the way I ended up on this path was from a very tragic event. I was maybe 19, and my girlfriend at the time was killed in a car accident. And I passed the accident, and I didnt know it was her and I kept going and I found out shortly after that, it was her.

And I was living in a basement apartment; I had no money; I had no heat, no air, I had a mattress on the floor and the apartment was infested with fleas. And I was soul-searching, I was like, why is she suddenly gone, and there are fleas here? I dont understand, there must be a purpose and wouldnt it be so convenient if we could pick up the phone and call God and ask these questions.

And I started writing and what poured out of me was an imaginary conversation with God, which was one-sided and I finished writing it and I looked at it and I said to myself, and I hadnt even been doing stand-up, ever, there was no club in town. I said, Im going do this on the Tonight Show with Johnny Carson at the time he was the king and Im going be the first woman in the history of the show to be called over to sit down. and several years later, I was the first woman in the history of the show, and only woman in the history of the show to sit down, because of that phone conversation with God that I wrote.

And I started this path of stand-up and it was successful and it was great but it was hard because I was trying to please everybody and I had this secret that I was keeping, that I was gay. And I thought if people found out they wouldnt like me, they wouldnt laugh at me. Then my career turned into, I got my own sitcom, and that was very successful, another level of success. And I thought, what if they find out Im gay, then theyll never watch, and this was a long time ago, this was when we just had white presidents. But anyway, this was back many years ago.

And I finally decided that I was living with so much shame, and so much fear, that I just couldnt live that way anymore and I decided to come out and make it creative. And my character would come out at the same time, and it wasnt to make a political statement, it wasnt to do anything other than to free myself up from this heaviness that I was carrying around, and I just wanted to be honest. And I thought, Whats the worst that could happen? I can lose my career. I did. I lost my career. The show was cancelled after six years without even telling me; I read it in the paper. The phone didnt ring for three years. I had no offers. Nobody wanted to touch me at all.

Yet, I was getting letters from kids that almost committed suicide, but didnt because of what I did. And I realized that I had a purpose. And it wasnt just about me and it wasnt about celebrity, but I felt like I was being punished and it was a bad time, I was angry, I was sad, and then I was offered a talk show. And the people that offered me the talk show tried to sell it. And most stations didnt want to pick it up. Most people didnt want to buy it because they thought nobody would watch me.

Really when I look back on it, I wouldnt change a thing. I mean, it was so important for me to lose everything because I found out what the most important thing is, is to be true to yourself. Ultimately, thats whats gotten me to this place. I dont live in fear, Im free; I have no secrets and I know Ill always be OK, because no matter what, I know who I am.

So In conclusion, when I was younger I thought success was something different. I thought when I grow up, I want to be famous. I want to be a star. I want to be in movies. When I grow up I want to see the world, drive nice cars, I want to have groupies. To quote the Pussycat Dolls. How many people thought it was boobies, by the way? Its not, its groupies.

But my idea of success is different today. And as you grow, youll realize the definition of success changes. For many of you, today, success is being able to hold down 20 shots of tequila. For me, the most important thing in your life is to live your life with integrity and not to give into peer pressure to try to be something that youre not, to live your life as an honest and compassionate person, to contribute in some way. So to conclude my conclusion, follow your passion, stay true to yourself. Never follow anyone elses path, unless youre in the woods and youre lost and you see a path and by all means you should follow that.

Dont give advice, it will come back and bite you in the ass. Dont take anyones advice. So my advice to you is to be true to yourself and everything will be fine. And I know that a lot of you are concerned about your future, but theres no need to worry. The economy is booming, the job market is wide open, the planet is just fine. Its going be great.

Youve already survived a hurricane. What else can happen to you? And as I mentioned before, some of the most devastating things that happen to you will teach you the most. And now you know the right questions to ask in your first job interview. Like, Is it above sea level?

So to conclude my conclusion that Ive previously concluded, in the common cement speech, I guess what Im trying to say is life is like one big Mardi Gras. But instead of showing your boobs, show people your brain, and if they like what they see, youll have more beads than you know what to do with and youll be drunk, most of the time.

So the Katrina class of 2009, I say congratulations and if you dont remember a thing I said today, remember this, youre going to be OK, dum de dumdumdum, just dance.",Persuasive
