Title,Date,Author,Speech,Category
Best Original Song Oscars Award Acceptance Speech,22-02-2015,John Legend and Common,"First off, I'd like to thank God that lives in us all. Recently, John and I got to go to Selma and perform ""Glory"" on the same bridge that Dr. King and the people of the civil rights movement marched on 50 years ago. This bridge was once a landmark of a divided nation, but now is a symbol for change. The spirit of this bridge transcends race, gender, religion, sexual orientation, and social status. The spirit of this bridge connects the kid from the South side of Chicago, dreaming of a better life to those in France standing up for their freedom of expression to the people in Hong Kong protesting for democracy. This bridge was built on hope. Welded with compassion. And elevated by love for all human beings.

Thank you. Nina Simone said it's an artist's duty to reflect the times in which we live. We wrote this song for a film that was based on events that were 50 years ago, but we say Selma is now, because the struggle for justice is right now. We know that the voting rights, the act that they fought for 50 years ago is being compromised right now in this country today. We know that right now the struggle for freedom and justice is real. We live in the most incarcerated country in the world. There are more black men under correctional control today than were under slavery in 1850. When people are marching with our song, we want to tell you that we are with you, we see you, we love you, and march on.",Ceremonial
Best Adapted Screenplay Award Acceptance Speech,27-02-2017,Barry Jenkins and Tarell Alvin McCraney,"Thank you to the Academy. Thank you, A24. Thank you Plan B. Thank you to our amazing cast. Thank you, my mom, my sister, everybody in Miami. I want to thank my reps, three amigos, Jay Baker at CAA, Joel Ross and Jamie Feldman. And two women in particular. My publicist, Paula Woods and Paula Seacrest. Thank you for taking care of me. I told my students, be in love with the process, not the result. I really wanted this result. All you people who feel like there's no mirror for you, the academy has your back, the ACLU has your back, we have your back, and for the next four years, we will not forget you.

Tarell Alvin McCraney: Amen, brother. I just want to echo everything he just said, but I want to say thank God for my mother, who proved to me through her struggles and the struggles that Naomie Harris portrayed for you, that we can be somebody. Two boys from Liberty City up here representing 305. This goes out to all those black and brown boys and girls and nongender conforming who don't see themselves, we're trying to show you you, and us. Thank you, thank you. This is for you.",Ceremonial
Best Original Screenplay Oscars Award Acceptance Speech,23-03-1998,Ben Affleck and Matt Damon,"I just said to Matt, losing would suck and winning would be really scary. It's really, really scary. We're just really two young guys who were fortunate enough to be involved with a lot of great people whom it's incumbent upon us -- there's no way we're doing this in less than twenty seconds -- upon whom it's incumbent of us to thank. Harvey Weinstein, who believed in us and made this movie. Gus Van Sant, for brilliant direction. Robin Williams, who delivered such great lines. Minnie Driver, whose performance was brilliant. Stellan Skarsgard, who was great. (Your brother.) My brother Casey, who's brilliant in the movie. (Cole Hauser.) Cole Hauser. My mother (Jon Gordon) and Matt's mother, (my mom) the most beautiful women here. (My dad right over there. Jack said hi to you. Alright!) Shhh... (Jon Gordon from Miramax.) Jon Gordon. Chris Moore (Chris Moore!), who produced the movie (Chris Moore!). Patrick Whitesell, the best agent in Hollywood! (Yeah! Patrick Whitesell!) And Cuba Gooding, for showing us how to give [an] alright acceptance speech! (All our friends and family! And everybody back in Boston watching us tonight!) And thank you so much to the city of Boston... And I know we're forgetting somebody. (Whoever we forgot we love you! We love you!) Thank you! Thank you so much!",Ceremonial
Tilbury Speech,19-07-1588,Queen Elizabeth I,"My loving people,

We have been persuaded by some that are careful of our safety, to take heed how we commit our selves to armed multitudes, for fear of treachery; but I assure you I do not desire to live to distrust my faithful and loving people.

Let tyrants fear. I have always so behaved myself that, under God, I have placed my chiefest strength and safeguard in the loyal hearts and good-will of my subjects; and therefore I am come amongst you, as you see, at this time, not for my recreation and disport, but being resolved, in the midst and heat of the battle, to live and die amongst you all; to lay down for my God, and for my kingdom, and my people, my honour and my blood, even in the dust.

I know I have the body of a weak, feeble woman; but I have the heart and stomach of a king, and of a king of England too, and think foul scorn that Parma or Spain, or any prince of Europe, should dare to invade the borders of my realm; to which rather than any dishonour shall grow by me, I myself will take up arms, I myself will be your general, judge, and rewarder of every one of your virtues in the field.

I know already, for your forwardness you have deserved rewards and crowns; and We do assure you on a word of a prince, they shall be duly paid. In the mean time, my lieutenant general shall be in my stead, than whom never prince commanded a more noble or worthy subject; not doubting but by your obedience to my general, by your concord in the camp, and your valour in the field, we shall shortly have a famous victory over these enemies of my God, of my kingdom, and of my people.",Ceremonial
Aint I A Woman,21-07-1851,Sojourner Truth,"That man over there says that women need to be helped into carriages, and lifted over ditches, and to have the best place everywhere. Nobody ever helps me into carriages, or over mud-puddles, or gives me any best place! And aint I a woman? Look at me! Look at my arm! I have ploughed and planted, and gathered into barns, and no man could head me! And aint I a woman? I could work as much and eat as much as a man  when I could get it  and bear the lash as well! And aint I a woman? I have borne thirteen children, and seen most all sold off to slavery, and when I cried out with my mothers grief, none but Jesus heard me! And aint I a woman?

If the first woman God ever made was strong enough to turn the world upside down all alone, these women together ought to be able to turn it back , and get it right side up again! And now they is asking to do it, the men better let them",Ceremonial
Barack Obama 2008 presidential election victory speech,04-11-2008,Barack Obama,"If there is anyone out there who still doubts that America is a place where all things are possible; who still wonders if the dream of our founders is alive in our time; who still questions the power of our democracy, tonight is your answer.

It's the answer told by lines that stretched around schools and churches in numbers this nation has never seen; by people who waited three hours and four hours, many for the very first time in their lives, because they believed that this time must be different; that their voice could be that difference.

It's the answer spoken by young and old, rich and poor, Democrat and Republican, black, white, Latino, Asian, Native American, gay, straight, disabled and not disabled  Americans who sent a message to the world that we have never been a collection of red states and blue states; we are, and always will be, the United States of America.

Sponsor Message
It's the answer that led those who have been told for so long by so many to be cynical, and fearful, and doubtful of what we can achieve to put their hands on the arc of history and bend it once more toward the hope of a better day.

It's been a long time coming, but tonight, because of what we did on this day, in this election, at this defining moment, change has come to America.

I just received a very gracious call from Sen. McCain. He fought long and hard in this campaign, and he's fought even longer and harder for the country he loves. He has endured sacrifices for America that most of us cannot begin to imagine, and we are better off for the service rendered by this brave and selfless leader. I congratulate him and Gov. Palin for all they have achieved, and I look forward to working with them to renew this nation's promise in the months ahead.

I want to thank my partner in this journey, a man who campaigned from his heart and spoke for the men and women he grew up with on the streets of Scranton and rode with on that train home to Delaware, the vice-president-elect of the United States, Joe Biden.

Sponsor Message
I would not be standing here tonight without the unyielding support of my best friend for the last 16 years, the rock of our family and the love of my life, our nation's next first lady, Michelle Obama. Sasha and Malia, I love you both so much, and you have earned the new puppy that's coming with us to the White House. And while she's no longer with us, I know my grandmother is watching, along with the family that made me who I am. I miss them tonight, and know that my debt to them is beyond measure.

To my campaign manager, David Plouffe; my chief strategist, David Axelrod; and the best campaign team ever assembled in the history of politics  you made this happen, and I am forever grateful for what you've sacrificed to get it done.

But above all, I will never forget who this victory truly belongs to  it belongs to you.

I was never the likeliest candidate for this office. We didn't start with much money or many endorsements. Our campaign was not hatched in the halls of Washington  it began in the backyards of Des Moines and the living rooms of Concord and the front porches of Charleston.

It was built by working men and women who dug into what little savings they had to give $5 and $10 and $20 to this cause. It grew strength from the young people who rejected the myth of their generation's apathy; who left their homes and their families for jobs that offered little pay and less sleep; from the not-so-young people who braved the bitter cold and scorching heat to knock on the doors of perfect strangers; from the millions of Americans who volunteered and organized, and proved that more than two centuries later, a government of the people, by the people and for the people has not perished from this earth. This is your victory.

I know you didn't do this just to win an election, and I know you didn't do it for me. You did it because you understand the enormity of the task that lies ahead. For even as we celebrate tonight, we know the challenges that tomorrow will bring are the greatest of our lifetime  two wars, a planet in peril, the worst financial crisis in a century. Even as we stand here tonight, we know there are brave Americans waking up in the deserts of Iraq and the mountains of Afghanistan to risk their lives for us. There are mothers and fathers who will lie awake after their children fall asleep and wonder how they'll make the mortgage, or pay their doctor's bills, or save enough for college. There is new energy to harness and new jobs to be created; new schools to build and threats to meet and alliances to repair.

The road ahead will be long. Our climb will be steep. We may not get there in one year, or even one term, but America  I have never been more hopeful than I am tonight that we will get there. I promise you: We as a people will get there.

There will be setbacks and false starts. There are many who won't agree with every decision or policy I make as president, and we know that government can't solve every problem. But I will always be honest with you about the challenges we face. I will listen to you, especially when we disagree. And, above all, I will ask you join in the work of remaking this nation the only way it's been done in America for 221 years  block by block, brick by brick, callused hand by callused hand.

What began 21 months ago in the depths of winter must not end on this autumn night. This victory alone is not the change we seek  it is only the chance for us to make that change. And that cannot happen if we go back to the way things were. It cannot happen without you.

So let us summon a new spirit of patriotism; of service and responsibility where each of us resolves to pitch in and work harder and look after not only ourselves, but each other. Let us remember that if this financial crisis taught us anything, it's that we cannot have a thriving Wall Street while Main Street suffers. In this country, we rise or fall as one nation  as one people.

Let us resist the temptation to fall back on the same partisanship and pettiness and immaturity that has poisoned our politics for so long. Let us remember that it was a man from this state who first carried the banner of the Republican Party to the White House  a party founded on the values of self-reliance, individual liberty and national unity. Those are values we all share, and while the Democratic Party has won a great victory tonight, we do so with a measure of humility and determination to heal the divides that have held back our progress.

As Lincoln said to a nation far more divided than ours, ""We are not enemies, but friends... Though passion may have strained, it must not break our bonds of affection."" And, to those Americans whose support I have yet to earn, I may not have won your vote, but I hear your voices, I need your help, and I will be your president, too.

And to all those watching tonight from beyond our shores, from parliaments and palaces to those who are huddled around radios in the forgotten corners of our world  our stories are singular, but our destiny is shared, and a new dawn of American leadership is at hand. To those who would tear this world down: We will defeat you. To those who seek peace and security: We support you. And to all those who have wondered if America's beacon still burns as bright: Tonight, we proved once more that the true strength of our nation comes not from the might of our arms or the scale of our wealth, but from the enduring power of our ideals: democracy, liberty, opportunity and unyielding hope.

For that is the true genius of America  that America can change. Our union can be perfected. And what we have already achieved gives us hope for what we can and must achieve tomorrow.

This election had many firsts and many stories that will be told for generations. But one that's on my mind tonight is about a woman who cast her ballot in Atlanta. She's a lot like the millions of others who stood in line to make their voice heard in this election, except for one thing: Ann Nixon Cooper is 106 years old.

She was born just a generation past slavery; a time when there were no cars on the road or planes in the sky; when someone like her couldn't vote for two reasons  because she was a woman and because of the color of her skin.

And tonight, I think about all that she's seen throughout her century in America  the heartache and the hope; the struggle and the progress; the times we were told that we can't and the people who pressed on with that American creed: Yes, we can.

At a time when women's voices were silenced and their hopes dismissed, she lived to see them stand up and speak out and reach for the ballot. Yes, we can.

When there was despair in the Dust Bowl and depression across the land, she saw a nation conquer fear itself with a New Deal, new jobs and a new sense of common purpose. Yes, we can.

When the bombs fell on our harbor and tyranny threatened the world, she was there to witness a generation rise to greatness and a democracy was saved. Yes, we can.

She was there for the buses in Montgomery, the hoses in Birmingham, a bridge in Selma and a preacher from Atlanta who told a people that ""We Shall Overcome."" Yes, we can.

A man touched down on the moon, a wall came down in Berlin, a world was connected by our own science and imagination. And this year, in this election, she touched her finger to a screen and cast her vote, because after 106 years in America, through the best of times and the darkest of hours, she knows how America can change. Yes, we can.

America, we have come so far. We have seen so much. But there is so much more to do. So tonight, let us ask ourselves: If our children should live to see the next century; if my daughters should be so lucky to live as long as Ann Nixon Cooper, what change will they see? What progress will we have made?

This is our chance to answer that call. This is our moment. This is our time  to put our people back to work and open doors of opportunity for our kids; to restore prosperity and promote the cause of peace; to reclaim the American Dream and reaffirm that fundamental truth that out of many, we are one; that while we breathe, we hope, and where we are met with cynicism, and doubt, and those who tell us that we can't, we will respond with that timeless creed that sums up the spirit of a people: Yes, we can.

Thank you, God bless you, and may God bless the United States of America.",Ceremonial
