Title,Date,Author,Speech,Category
Inaugural Address,20-01-2017,Donald Trump,"Chief Justice Roberts, President Carter, President Clinton, President Bush, President Obama, fellow Americans, and people of the world: thank you.

We, the citizens of America, are now joined in a great national effort to rebuild our country and to restore its promise for all of our people.

Together, we will determine the course of America and the world for years to come.

We will face challenges. We will confront hardships. But we will get the job done.

Every four years, we gather on these steps to carry out the orderly and peaceful transfer of power, and we are grateful to President Obama and First Lady Michelle Obama for their gracious aid throughout this transition. They have been magnificent.

Today?s ceremony, however, has very special meaning. Because today we are not merely transferring power from one Administration to another, or from one party to another ? but we are transferring power from Washington, D.C. and giving it back to you, the American People.

For too long, a small group in our nation?s Capital has reaped the rewards of government while the people have borne the cost.

Washington flourished ? but the people did not share in its wealth.

Politicians prospered ? but the jobs left, and the factories closed.

The establishment protected itself, but not the citizens of our country.

Their victories have not been your victories; their triumphs have not been your triumphs; and while they celebrated in our nation?s Capital, there was little to celebrate for struggling families all across our land.

That all changes ? starting right here, and right now, because this moment is your moment: it belongs to you.

It belongs to everyone gathered here today and everyone watching all across America. 

This is your day. This is your celebration.

And this, the United States of America, is your country.

What truly matters is not which party controls our government, but whether our government is controlled by the people.

January 20th 2017, will be remembered as the day the people became the rulers of this nation again. 

The forgotten men and women of our country will be forgotten no longer.

Everyone is listening to you now.

You came by the tens of millions to become part of a historic movement the likes of which the world has never seen before.

At the center of this movement is a crucial conviction: that a nation exists to serve its citizens.

Americans want great schools for their children, safe neighborhoods for their families, and good jobs for themselves.

These are the just and reasonable demands of a righteous public.

But for too many of our citizens, a different reality exists: Mothers and children trapped in poverty in our inner cities; rusted-out factories scattered like tombstones across the landscape of our nation; an education system, flush with cash, but which leaves our young and beautiful students deprived of knowledge; and the crime and gangs and drugs that have stolen too many lives and robbed our country of so much unrealized potential.

This American carnage stops right here and stops right now.

We are one nation ? and their pain is our pain.  Their dreams are our dreams; and their success will be our success.  We share one heart, one home, and one glorious destiny.

The oath of office I take today is an oath of allegiance to all Americans.

For many decades, we?ve enriched foreign industry at the expense of American industry;

Subsidized the armies of other countries while allowing for the very sad depletion of our military;

We've defended other nation?s borders while refusing to defend our own;

And spent trillions of dollars overseas while America's infrastructure has fallen into disrepair and decay.

We?ve made other countries rich while the wealth, strength, and confidence of our country has disappeared over the horizon.

One by one, the factories shuttered and left our shores, with not even a thought about the millions upon millions of American workers left behind.

The wealth of our middle class has been ripped from their homes and then redistributed across the entire world.

But that is the past. And now we are looking only to the future.

We assembled here today are issuing a new decree to be heard in every city, in every foreign capital, and in every hall of power.

From this day forward, a new vision will govern our land.

From this moment on, it?s going to be America First.

Every decision on trade, on taxes, on immigration, on foreign affairs, will be made to benefit American workers and American families.

We must protect our borders from the ravages of other countries making our products, stealing our companies, and destroying our jobs.  Protection will lead to great prosperity and strength.

I will fight for you with every breath in my body ? and I will never, ever let you down.

America will start winning again, winning like never before.

We will bring back our jobs. We will bring back our borders.  We will bring back our wealth.  And we will bring back our dreams.

We will build new roads, and highways, and bridges, and airports, and tunnels, and railways all across our wonderful nation.

We will get our people off of welfare and back to work ? rebuilding our country with American hands and American labor.

We will follow two simple rules: Buy American and Hire American.

We will seek friendship and goodwill with the nations of the world ? but we do so with the understanding that it is the right of all nations to put their own interests first.

We do not seek to impose our way of life on anyone, but rather to let it shine as an example for everyone to follow.

We will reinforce old alliances and form new ones ? and unite the civilized world against Radical Islamic Terrorism, which we will eradicate completely from the face of the Earth.

At the bedrock of our politics will be a total allegiance to the United States of America, and through our loyalty to our country, we will rediscover our loyalty to each other.

When you open your heart to patriotism, there is no room for prejudice.

The Bible tells us, ?how good and pleasant it is when God?s people live together in unity.?

We must speak our minds openly, debate our disagreements honestly, but always pursue solidarity.

When America is united, America is totally unstoppable.

There should be no fear ? we are protected, and we will always be protected.

We will be protected by the great men and women of our military and law enforcement and, most importantly, we are protected by God.

Finally, we must think big and dream even bigger.

In America, we understand that a nation is only living as long as it is striving.

We will no longer accept politicians who are all talk and no action ? constantly complaining but never doing anything about it.

The time for empty talk is over.

Now arrives the hour of action.

Do not let anyone tell you it cannot be done.  No challenge can match the heart and fight and spirit of America.

We will not fail. Our country will thrive and prosper again.

We stand at the birth of a new millennium, ready to unlock the mysteries of space, to free the Earth from the miseries of disease, and to harness the energies, industries and technologies of tomorrow.

A new national pride will stir our souls, lift our sights, and heal our divisions.

It is time to remember that old wisdom our soldiers will never forget: that whether we are black or brown or white, we all bleed the same red blood of patriots, we all enjoy the same glorious freedoms, and we all salute the same great American Flag.

And whether a child is born in the urban sprawl of Detroit or the windswept plains of Nebraska, they look up at the same night sky, they fill their heart with the same dreams, and they are infused with the breath of life by the same almighty Creator.

So to all Americans, in every city near and far, small and large, from mountain to mountain, and from ocean to ocean, hear these words:

You will never be ignored again.

Your voice, your hopes, and your dreams, will define our American destiny. And your courage and goodness and love will forever guide us along the way.

Together, We Will Make America Strong Again.

We Will Make America Wealthy Again.

We Will Make America Proud Again.

We Will Make America Safe Again.

And, Yes, Together, We Will Make America Great Again. Thank you, God Bless You, And God Bless America.",Persuasive
Gettysburg Address,19-11-1863,Abraham Lincoln,"Four score and seven years ago our fathers brought forth on this continent, a new nation, conceived in Liberty, and dedicated to the proposition that all men are created equal. Now we are engaged in a great civil war, testing whether that nation, or any nation so conceived and so dedicated, can long endure. We are met on a great battle-field of that war. We have come to dedicate a portion of that field, as a final resting place for those who here gave their lives that that nation might live. It is altogether fitting and proper that we should do this. But, in a larger sense, we can not dedicate?we can not consecrate?we can not hallow?this ground. The brave men, living and dead, who struggled here, have consecrated it, far above our poor power to add or detract. The world will little note, nor long remember what we say here, but it can never forget what they did here. It is for us the living, rather, to be dedicated here to the unfinished work which they who fought here have thus far so nobly advanced. It is rather for us to be here dedicated to the great task remaining before us?that from these honored dead we take increased devotion to that cause for which they gave the last full measure of devotion?that we here highly resolve that these dead shall not have died in vain?that this nation, under God, shall have a new birth of freedom?and that government of the people, by the people, for the people, shall not perish from the earth.",Persuasive
Address to Congress,02-04-1917,Woodrow Wilson,"The world must be made safe for democracy. Its peace must be planted upon the tested foundations of political liberty. We have no selfish ends to serve. We desire no conquest, no dominion. We seek no indemnities for ourselves, no material compensation for the sacrifices we shall freely make. We are but one of the champions of the rights of mankind. We shall be satisfied when those rights have been made as secure as the faith and the freedom of nations can make them.

Just because we fight without rancor and without selfish object, seeking nothing for ourselves but what we shall wish to share with all free peoples, we shall, I feel confident, conduct our operations as belligerents without passion and ourselves observe with proud punctilio the principles of right and of fair play we profess to be fighting for.



It will be all the easier for us to conduct ourselves as belligerents in a high spirit of right and fairness because we act without animus, not in enmity toward a people or with the desire to bring any injury or disadvantage upon them, but only in armed opposition to an irresponsible government which has thrown aside all considerations of humanity and of right and is running amuck. We are, let me say again, the sincere friends of the German people, and shall desire nothing so much as the early reestablishment of intimate relations of mutual advantage between ushowever hard it may be for them, for the time being, to believe that this is spoken from our hearts.

We have borne with their present government through all these bitter months because of that friendshipexercising a patience and forbearance which would otherwise have been impossible. We shall, happily, still have an opportunity to prove that friendship in our daily attitude and actions toward the millions of men and women of German birth and native sympathy who live among us and share our life, and we shall be proud to prove it toward all who are in fact loyal to their neighbors and to the government in the hour of test. They are, most of them, as true and loyal Americans as if they had never known any other fealty or allegiance. They will be prompt to stand with us in rebuking and restraining the few who may be of a different mind and purpose. If there should be disloyalty, it will be dealt with with a firm hand of stern repression; but, if it lifts its head at all, it will lift it only here and there and without countenance except from a lawless and malignant few.

It is a distressing and oppressive duty, gentlemen of the Congress, which I have performed in thus addressing you. There are, it may be, many months of fiery trial and sacrifice ahead of us. It is a fearful thing to lead this great peaceful people into war, into the most terrible and disastrous of all wars, civilization itself seeming to be in the balance. But the right is more precious than peace, and we shall fight for the things which we have always carried nearest our heartsfor democracy, for the right of those who submit to authority to have a voice in their own governments, for the rights and liberties of small nations, for a universal dominion of right by such a concert of free peoples as shall bring peace and safety to all nations and make the world itself at last free.

To such a task we can dedicate our lives and our fortunes, everything that we are and everything that we have, with the pride of those who know that the day has come when America is privileged to spend her blood and her might for the principles that gave her birth and happiness and the peace which she has treasured. God helping her, she can do no other.",Persuasive
I have a dream,28-07-1963,Martin Luther King Jr.,"I have a dream that one day down in Alabama, with its vicious racists, with its governor having his lips dripping with the words of interposition and nullification  one day right there in Alabama little black boys and black girls will be able to join hands with little white boys and white girls as sisters and brothers.

I have a dream today.

I have a dream that one day every valley shall be exalted, and every hill and mountain shall be made low, the rough places will be made plain, and the crooked places will be made straight, and the glory of the Lord shall be revealed and all flesh shall see it together.

This is our hope. This is the faith that I go back to the South with. With this faith we will be able to hew out of the mountain of despair a stone of hope. With this faith we will be able to transform the jangling discords of our nation into a beautiful symphony of brotherhood. With this faith we will be able to work together, to pray together, to struggle together, to go to jail together, to stand up for freedom together, knowing that we will be free one day.

This will be the day, this will be the day when all of Gods children will be able to sing with new meaning My country tis of thee, sweet land of liberty, of thee I sing. Land where my fathers died, land of the Pilgrims pride, from every mountainside, let freedom ring!",Persuasive
Womans Rights to the Suffrage,08-03-1884,Susan B Anthony,"For any State to make sex a qualification that must ever result in the disfranchisement of one entire half of the people is to pass a bill of attainder, or an ex post facto law, and is therefore a violation of the supreme law of the land. By it the blessings of liberty are for ever withheld from women and their female posterity. To them this government has no just powers derived from the consent of the governed. To them this government is not a democracy. It is not a republic. It is an odious aristocracy; a hateful oligarchy of sex; the most hateful aristocracy ever established on the face of the globe; an oligarchy of wealth, where the right govern the poor. An oligarchy of learning, where the educated govern the ignorant, or even an oligarchy of race, where the Saxon rules the African, might be endured; but this oligarchy of sex, which makes father, brothers, husband, sons, the oligarchs over the mother and sisters, the wife and daughters of every householdwhich ordains all men sovereigns, all women subjects, carries dissension, discord and rebellion into every home of the nation.

Webster, Worcester and Bouvier all define a citizen to be a person in the United States, entitled to vote and hold office.

The only question left to be settled now is: Are women persons? And I hardly believe any of our opponents will have the hardihood to say they are not. Being persons, then, women are citizens; and no State has a right to make any law, or to enforce any old law, that shall abridge their privileges or immunities. Hence, every discrimination against women in the constitutions and laws of the several States is today null and void, precisely as in every one against Negroes.",Persuasive
Martial Law Units,04-06-1989,Deng Xiaoping,"This army still maintains the traditions of our old Red Army. What they crossed this time was in the true sense of the expression a political barrier, a threshold of life and death. This was not easy. This shows that the Peoples Army is truly a great wall of iron and steel of the party and state. This shows that no matter how heavy our losses, the army, under the leadership of the party, will always remain the defender of the country, the defender of socialism, and the defender of the public interest. They are a most lovable people. At the same time, we should never forget how cruel our enemies are. We should have not one bit of forgiveness for them.

The fact that this incident broke out as it did is very worthy of our pondering. It prompts us cool-headedly to consider the past and the future. Perhaps this bad thing will enable us to go ahead with reform and the open policy at a steadier and better  even a faster  pace, more speedily correct our mistakes, and better develop our strong points",Persuasive
Quit India,08-07-1942,Mahatma Gandhi,"We shall either free India or die in the attempt; we shall not live to see the perpetuation of our slavery. Every true Congressman or woman will join the struggle with an inflexible determination not to remain alive to see the country in bondage and slavery. Let that be your pledge. Keep jails out of your consideration. If the Government keep me free, I will not put on the Government the strain of maintaining a large number of prisoners at a time, when it is in trouble. Let every man and woman live every moment of his or her life hereafter in the consciousness that he or she eats or lives for achieving freedom and will die, if need be, to attain that goal. Take a pledge, with God and your own conscience as witness, that you will no longer rest till freedom is achieved and will be prepared to lay down your lives in the attempt to achieve it. He who loses his life will gain it; he who will seek to save it shall lose it. Freedom is not for the coward or the faint-hearted",Persuasive
